{
  "case_id": "L1_MELVILLE_BARTLEBY_001",
  "edition_rights_basis": "Project Gutenberg eBook #11231 is the public source/edition reference recorded for this case; public catalog metadata identifies the source title as \"Bartleby, the Scrivener: A Story of Wall-Street\" and reports copyright=false. The study packet remains controlled and is not approved for inspection or provider transmission by this evidence record.",
  "evidence_documents": [
    "docs/studies/human_llm_rights_inventory.md",
    "data/studies/human_llm_pilot/rights_inventory_manifest.json",
    "docs/studies/human_llm_rights_evidence_summary.md"
  ],
  "evidence_urls_or_citations": [
    "https://www.gutenberg.org/ebooks/11231",
    "https://www.gutenberg.org/cache/epub/11231/pg11231.rdf",
    "https://gutendex.com/books/11231",
    "https://www.gutenberg.org/policy/license.html"
  ],
  "jurisdiction_note": "Conservative protocol-review note: the evidence supports the documented Project Gutenberg/Gutendex public-domain/source basis, primarily a public-source and United States/public-domain metadata basis. This record does not claim global copyright clearance and does not approve private-packet inspection, provider transmission, human coding, model execution, or public redistribution beyond the documented source/provider basis.",
  "notes": "L1 documentary evidence pass completed using public metadata and public source/provider citations only; no private source-packet text was inspected or committed. Private-packet inspection, controlled private-packet handling, provider transmission, provider/model/account verification, runtime settings, pricing, final authorization, human coding, and model execution remain blocked.",
  "publication_or_death_date_evidence": "Public catalog metadata records Herman Melville birth/death years as 1819-1891; the author death year 1891 supplies the documented date evidence for public-domain protocol review of this English-original L1 source.",
  "record_hash": "sha256:79080b813869250910ae7a8b829ae24d952545b6519a5b498d30c5070045727a",
  "review_date": "2026-07-06",
  "reviewer": "author-assisted internal rights evidence preparation",
  "rights_basis": "Documentary public-domain/source evidence recorded for protocol review: public catalog metadata identifies Herman Melville (1819-1891) as author of the Project Gutenberg source for Herman Melville, Bartleby, the Scrivener; Gutendex metadata for Project Gutenberg eBook #11231 reports copyright=false, and Project Gutenberg source metadata identifies the eBook as public-domain/source-provider material.",
  "source_identifier": "Herman Melville, Bartleby, the Scrivener",
  "source_layer": "English",
  "status": "RIGHTS_DOCUMENTED_PUBLIC_DOMAIN",
  "translation_rights_basis": "not_applicable",
  "uncertainty": "medium"
}
