{
  "case_id": "L2_MALORY_MORTE_001",
  "edition_rights_basis": "blocked_pending_edition_review; public inventory records source provider Project Gutenberg and edition/source status: Project Gutenberg eBook #1251, Le Morte d’Arthur: Volume 1",
  "evidence_documents": [
    "docs/studies/human_llm_rights_inventory.md",
    "data/studies/human_llm_pilot/rights_inventory_manifest.json"
  ],
  "evidence_urls_or_citations": [
    "https://www.gutenberg.org/cache/epub/1251/pg1251.txt",
    "https://www.gutenberg.org/policy/license.html"
  ],
  "jurisdiction_note": "blocked_pending_jurisdiction_specific_review; public source URL responded to header availability check, but redistribution/provider-transmission rights are not approved by this record.",
  "notes": "Evidence record created from public metadata and public source URL header availability only. It does not inspect source text, does not approve rights, does not approve translation rights, does not approve private-packet inspection, and does not authorize provider transmission, human coding, or model execution.",
  "publication_or_death_date_evidence": "blocked_pending_publication_or_death_date_review; public inventory records source/tradition metadata: Thomas Malory / Project Gutenberg eBook #1251, Le Morte d’Arthur: Volume 1",
  "record_hash": "sha256:acd941aca2877b6cb6cb889da209d230afbd38d8f9146c01fdbb98111a7af533",
  "review_date": null,
  "reviewer": "author-assisted internal rights evidence preparation",
  "rights_basis": "blocked_pending_documentary_review_public_source_metadata_collected",
  "source_identifier": "Thomas Malory, Le Morte d’Arthur",
  "source_layer": "English/Middle English public-domain edition",
  "status": "RIGHTS_TRANSLATION_REVIEW_REQUIRED",
  "translation_rights_basis": "blocked_pending_translation_specific_review_public_source_metadata_collected",
  "uncertainty": "not_assessed"
}
