{
  "case_id": "L2_HERODOTUS_SCYTHIAN_001",
  "edition_rights_basis": "blocked_pending_edition_reconciliation; Public inventory/source status names a George Rawlinson translation, but Gutendex metadata for Project Gutenberg eBook #2707 identifies G. C. Macaulay as translator. The exact translation/edition used must be reconciled before the case can pass.",
  "evidence_documents": [
    "docs/studies/human_llm_rights_inventory.md",
    "data/studies/human_llm_pilot/rights_inventory_manifest.json",
    "docs/studies/human_llm_rights_evidence_summary.md"
  ],
  "evidence_urls_or_citations": [
    "https://www.gutenberg.org/ebooks/2707",
    "https://www.gutenberg.org/ebooks/2707.rdf",
    "https://gutendex.com/books/2707",
    "https://www.gutenberg.org/policy/license.html"
  ],
  "jurisdiction_note": "blocked_pending_translation_edition_reconciliation; no private-packet inspection, provider transmission, human coding, model execution, or global clearance is approved.",
  "notes": "L2 documentary translation/source evidence pass found a public metadata conflict for the recorded translation/edition. The case remains blocked; no private source-packet text was inspected or committed. Private-packet inspection, controlled private-packet handling, provider transmission, provider/model/account verification, runtime settings, pricing, final authorization, human coding, and model execution remain blocked.",
  "publication_or_death_date_evidence": "blocked_pending_translation_edition_reconciliation; Public inventory/source status names a George Rawlinson translation, but Gutendex metadata for Project Gutenberg eBook #2707 identifies G. C. Macaulay as translator. The exact translation/edition used must be reconciled before the case can pass.",
  "record_hash": "sha256:5ad35f4126cdd6672cf8143e163bf9fa710074fe40c510c549403d8c79aaeafd",
  "review_date": null,
  "reviewer": "author-assisted internal rights evidence preparation",
  "rights_basis": "blocked_pending_translation_edition_reconciliation_public_metadata_conflict",
  "source_identifier": "Herodotus, The Histories",
  "source_layer": "English translation from Ancient Greek",
  "status": "RIGHTS_TRANSLATION_REVIEW_REQUIRED",
  "translation_rights_basis": "blocked_pending_translation_specific_review_public_metadata_conflict; Public inventory/source status names a George Rawlinson translation, but Gutendex metadata for Project Gutenberg eBook #2707 identifies G. C. Macaulay as translator. The exact translation/edition used must be reconciled before the case can pass.",
  "uncertainty": "not_assessed"
}
