{
  "case_id": "L2_HOMER_ODYSSEY_001",
  "edition_rights_basis": "Project Gutenberg eBook #1727 is the public source/edition reference recorded for this case; public catalog metadata identifies the source title as \"The Odyssey: Rendered into English prose for the use of those who cannot read the original\" and reports copyright=false. The study packet remains controlled and is not approved for inspection or provider transmission by this evidence record.",
  "evidence_documents": [
    "docs/studies/human_llm_rights_inventory.md",
    "data/studies/human_llm_pilot/rights_inventory_manifest.json",
    "docs/studies/human_llm_rights_evidence_summary.md"
  ],
  "evidence_urls_or_citations": [
    "https://www.gutenberg.org/ebooks/1727",
    "https://www.gutenberg.org/ebooks/1727.rdf",
    "https://gutendex.com/books/1727",
    "https://www.gutenberg.org/policy/license.html",
    "translation_or_source_edition_metadata:https://gutendex.com/books/1727"
  ],
  "jurisdiction_note": "Conservative protocol-review note: the evidence supports the documented Project Gutenberg/Gutendex public-domain/source-provider basis for the recorded translation or edition. This record does not claim global copyright clearance and does not approve private-packet inspection, provider transmission, human coding, model execution, or public redistribution beyond the documented source/provider basis. Downstream gates remain blocked.",
  "notes": "L2 documentary translation/source evidence pass completed using public metadata and public source/provider citations only; no private source-packet text was inspected or committed. Private-packet inspection, controlled private-packet handling, provider transmission, provider/model/account verification, runtime settings, pricing, final authorization, human coding, and model execution remain blocked.",
  "publication_or_death_date_evidence": "Public catalog metadata identifies the relevant translation/source edition as \"The Odyssey: Rendered into English prose for the use of those who cannot read the original\" and records Samuel Butler with date evidence: 1835-1902. This is the translation/edition-specific date evidence used for protocol review.",
  "record_hash": "sha256:2533ad3e861c552d52bcb9bbed49bf02e06fe3969309607a7e6edf2d97bc7015",
  "review_date": "2026-07-07",
  "reviewer": "author-assisted internal rights evidence preparation",
  "rights_basis": "Documentary translation/source evidence recorded for protocol review: Gutendex and Project Gutenberg metadata identify Project Gutenberg eBook #1727 as an English prose rendering by Samuel Butler, with copyright=false in public catalog metadata. The original/traditional source alone is not treated as sufficient; this record relies on the public translation or source-edition metadata for the selected Project Gutenberg source.",
  "source_identifier": "Homer, The Odyssey",
  "source_layer": "English translation from Ancient Greek",
  "status": "RIGHTS_DOCUMENTED_PUBLIC_DOMAIN",
  "translation_rights_basis": "Translation/edition-specific evidence: Samuel Butler; 1835-1902; Project Gutenberg/Gutendex eBook #1727 metadata for \"The Odyssey: Rendered into English prose for the use of those who cannot read the original\" reports copyright=false. This translation/edition basis is documented for protocol review only and does not authorize downstream private-packet or provider use.",
  "uncertainty": "medium"
}
