{
  "case_id": "L2_BIBLE_GENESIS_001",
  "edition_rights_basis": "Project Gutenberg eBook #10 is the public source/edition reference recorded for this case; public catalog metadata identifies the source title as \"The King James Version of the Bible\" and reports copyright=false. The study packet remains controlled and is not approved for inspection or provider transmission by this evidence record.",
  "evidence_documents": [
    "docs/studies/human_llm_rights_inventory.md",
    "data/studies/human_llm_pilot/rights_inventory_manifest.json",
    "docs/studies/human_llm_rights_evidence_summary.md"
  ],
  "evidence_urls_or_citations": [
    "https://www.gutenberg.org/ebooks/10",
    "https://www.gutenberg.org/ebooks/10.rdf",
    "https://gutendex.com/books/10",
    "https://www.gutenberg.org/policy/license.html",
    "translation_or_source_edition_metadata:https://gutendex.com/books/10"
  ],
  "jurisdiction_note": "Conservative protocol-review note: the evidence supports the documented Project Gutenberg/Gutendex public-domain/source-provider basis for the recorded translation or edition. This record does not claim global copyright clearance and does not approve private-packet inspection, provider transmission, human coding, model execution, or public redistribution beyond the documented source/provider basis. Downstream gates remain blocked.",
  "notes": "L2 documentary translation/source evidence pass completed using public metadata and public source/provider citations only; no private source-packet text was inspected or committed. Private-packet inspection, controlled private-packet handling, provider transmission, provider/model/account verification, runtime settings, pricing, final authorization, human coding, and model execution remain blocked.",
  "publication_or_death_date_evidence": "Public catalog metadata identifies the relevant translation/source edition as \"The King James Version of the Bible\" and records King James Version translators / public source edition with date evidence: translation first published 1611; no individual translator field recorded in Gutendex metadata. This is the translation/edition-specific date evidence used for protocol review.",
  "record_hash": "sha256:d8a187d82a99289a8954bc59e782f75d0b4821f22b67ef585ec760bb1399600d",
  "review_date": "2026-07-07",
  "reviewer": "author-assisted internal rights evidence preparation",
  "rights_basis": "Documentary translation/source evidence recorded for protocol review: Gutendex and Project Gutenberg metadata identify Project Gutenberg eBook #10 as The King James Version of the Bible, with copyright=false in public catalog metadata; jurisdiction-specific KJV/Crown-copyright questions remain caveated. The original/traditional source alone is not treated as sufficient; this record relies on the public translation or source-edition metadata for the selected Project Gutenberg source.",
  "source_identifier": "Genesis, King James Version",
  "source_layer": "English translation from Biblical Hebrew",
  "status": "RIGHTS_DOCUMENTED_PUBLIC_DOMAIN",
  "translation_rights_basis": "Translation/edition-specific evidence: King James Version translators / public source edition; translation first published 1611; no individual translator field recorded in Gutendex metadata; Project Gutenberg/Gutendex eBook #10 metadata for \"The King James Version of the Bible\" reports copyright=false. This translation/edition basis is documented for protocol review only and does not authorize downstream private-packet or provider use.",
  "uncertainty": "medium"
}
